{
  "pt" : {
    "synchronizePhysics" : false,
    "physicsTicksPerGameTick" : 3,
    "terrainBakingThreads" : 12,
    "terrainBakingThreadPriority" : 5,
    "terrainDeletionThreads" : 1,
    "terrainDeletionThreadPriority" : 4
  },
  "sp" : {
    "enableConnectivity" : true,
    "enableWorldConnectivity" : false,
    "enableBlockEdgeConnectivity" : true,
    "enableBlockCornerConnectivity" : false,
    "enableSplitting" : false,
    "verboseConnectivityLogging" : false
  },
  "udpPort" : 25565,
  "enableUdp" : false,
  "shipLoadDistance" : 128.0,
  "shipUnloadDistance" : 196.0,
  "physics" : {
    "lodDetail" : 512,
    "physicsSubSteps" : 1,
    "positionIterations" : 8,
    "velocityIterations" : 2,
    "maxDePenetrationSpeed" : 10.0,
    "physicsSpeed" : 1.0
  },
  "$schema" : "schemas/vs_core_server.schema.json"
}